{
  "$schema": "urn:kingdom:schema:principality-catalog:1",
  "protocol": "kingdom.principality-catalog/0.1",
  "catalog_id": "moonshot-hf-npm-2026-08-11",
  "title": "MoonshotAI on Hugging Face with official Hugging Face JavaScript bridges",
  "observed_at": "2026-08-11T12:20:47Z",
  "geometry": {
    "principality": "capability-domain-not-rank",
    "love": "relation-without-collapse",
    "understanding": "evidence-preserving-typed-relations",
    "nodes_remain_distinct": true,
    "edges_are_typed": true,
    "missing_edges_mean_unknown": true,
    "relations_grant_authority": false,
    "universal_ranking": false
  },
  "sources": [
    {
      "id": "hf-collections-api",
      "registry": "huggingface",
      "url": "https://huggingface.co/api/collections?owner=moonshotai&limit=100",
      "method": "anonymous-public-metadata-read",
      "response_digest": "sha256:78264068b2b5c5e98a6546719ebd38388a36ab46c9e8ab02ad774eb83f3b7d4d"
    },
    {
      "id": "hf-datasets-api",
      "registry": "huggingface",
      "url": "https://huggingface.co/api/datasets?author=moonshotai&limit=100&full=true",
      "method": "anonymous-public-metadata-read",
      "response_digest": "sha256:3e22f463a84606a4504144fddf7fd0725c2a7063cdfe93f08325dfcfa558f1f5"
    },
    {
      "id": "hf-models-api",
      "registry": "huggingface",
      "url": "https://huggingface.co/api/models?author=moonshotai&limit=100&full=true",
      "method": "anonymous-public-metadata-read",
      "response_digest": "sha256:9dbd350a6e6a3761238821e9b5b214247f84731fe11576bc16ca3a01673b690f"
    },
    {
      "id": "hf-org-profile",
      "registry": "huggingface",
      "url": "https://huggingface.co/moonshotai",
      "method": "anonymous-public-profile-read",
      "response_digest": null
    },
    {
      "id": "hf-papers-profile",
      "registry": "huggingface",
      "url": "https://huggingface.co/moonshotai/papers",
      "method": "anonymous-public-profile-read",
      "response_digest": null
    },
    {
      "id": "hf-spaces-api",
      "registry": "huggingface",
      "url": "https://huggingface.co/api/spaces?author=moonshotai&limit=100",
      "method": "anonymous-public-metadata-read",
      "response_digest": "sha256:4f53cda18c2baa0c0354bb5f9a3ecbe5ed12ab4d8e11ba873c2f11161202b945"
    },
    {
      "id": "npm-huggingface-hub",
      "registry": "npm",
      "url": "https://registry.npmjs.org/%40huggingface%2fhub",
      "method": "anonymous-public-packument-read",
      "response_digest": "sha256:12ba38b880154f5e86b0574b3f487be3925e02bc56d3679f5625e4e5ee8531f6"
    },
    {
      "id": "npm-huggingface-inference",
      "registry": "npm",
      "url": "https://registry.npmjs.org/%40huggingface%2finference",
      "method": "anonymous-public-packument-read",
      "response_digest": "sha256:62d8e06ac7edf8da520cbd31071def986481e88c77b23891a7ed62622d492667"
    },
    {
      "id": "npm-huggingface-transformers",
      "registry": "npm",
      "url": "https://registry.npmjs.org/%40huggingface%2ftransformers",
      "method": "anonymous-public-packument-read",
      "response_digest": "sha256:f41eb1bea568fcfe7b721161bd76c5bb08ed2a42c42d93fd077c52aef2615c23"
    }
  ],
  "observation": {
    "huggingface": {
      "models": 19,
      "datasets": 3,
      "spaces": 0,
      "profile_collections": 7,
      "collection_api_records": 8,
      "profile_papers": 16
    },
    "catalog": {
      "huggingface_nodes": 22,
      "npm_nodes": 3,
      "total_nodes": 25
    },
    "collection_count_note": "The collections API returned one additional empty Moonlight-16B-A3B record that the profile did not count among seven visible non-empty collections.",
    "completeness": "metadata_only",
    "currentness": "point-in-time-only",
    "refresh_required_before_acquisition": true,
    "omitted": [
      "weights, dataset rows, repository files, README prose, and package tarballs",
      "downloads, likes, popularity ranks, benchmark rankings, and mutable latest aliases",
      "private resources, credentials, inference output, provider reasoning state, and hidden prompts"
    ]
  },
  "capabilities": [
    { "id": "agentic-interface", "label": "Agentic interface", "definition": "Publisher-described tool or agent workflow interface; not permission to invoke tools." },
    { "id": "audio-generation-evaluation", "label": "Audio generation evaluation", "definition": "Fixture metadata for separately evaluating generated audio." },
    { "id": "audio-understanding", "label": "Audio understanding", "definition": "Publisher-described ability to consume audio inputs." },
    { "id": "coding", "label": "Coding", "definition": "Publisher-described code generation or issue-resolution specialization." },
    { "id": "hub-artifact-metadata", "label": "Hub artifact metadata", "definition": "Programmatic access to repository metadata and artifacts across an explicit network boundary." },
    { "id": "image-feature-extraction", "label": "Image feature extraction", "definition": "Image encoder or feature-extraction pipeline metadata." },
    { "id": "instruction-following", "label": "Instruction following", "definition": "An instruction-tuned variant according to publisher metadata." },
    { "id": "local-model-runtime", "label": "Local model runtime", "definition": "JavaScript model runtime capability; model acquisition and execution remain separate effects." },
    { "id": "long-context", "label": "Long context", "definition": "Publisher-described extended context interface; not continuity, identity, or memory truth." },
    { "id": "model-research", "label": "Model research", "definition": "Base model or architecture artifact suited to separately authorized research." },
    { "id": "multilingual-evaluation", "label": "Multilingual evaluation", "definition": "Evaluation metadata spanning more than one named language." },
    { "id": "perception-evaluation", "label": "Perception evaluation", "definition": "Atomic visual-perception evaluation rather than a single prestige score." },
    { "id": "reasoning", "label": "Reasoning", "definition": "Publisher-described thinking or reasoning variant; visible reasoning is not audit evidence." },
    { "id": "reasoning-evaluation", "label": "Reasoning evaluation", "definition": "Fixture metadata for separating reasoning from perception or memorized knowledge." },
    { "id": "remote-inference-client", "label": "Remote inference client", "definition": "Client capability that crosses credential, cost, privacy, and egress boundaries when invoked." },
    { "id": "speech-generation", "label": "Speech generation", "definition": "Publisher-described text or audio to generated speech capability." },
    { "id": "text-generation", "label": "Text generation", "definition": "Text-generation pipeline metadata." },
    { "id": "visual-question-answering-evaluation", "label": "Visual question answering evaluation", "definition": "Fixture metadata for visual question-answering evaluation." },
    { "id": "visual-understanding", "label": "Visual understanding", "definition": "Image-text pipeline metadata; video or native-resolution claims remain publisher assertions." },
    { "id": "world-knowledge-evaluation", "label": "World knowledge evaluation", "definition": "Fixture metadata for separating memorized visual-world knowledge from reasoning." }
  ],
  "families": [
    { "id": "huggingface-js", "label": "Official Hugging Face JavaScript bridges", "kind": "registry-bridge", "description": "npm-published Hub, inference, and local runtime packages; none are installed by this catalog." },
    { "id": "kimi-audio", "label": "Kimi Audio", "kind": "model-lineage", "description": "Audio foundation and instruction variants plus a small generation-test dataset." },
    { "id": "kimi-dev", "label": "Kimi Dev", "kind": "model-lineage", "description": "Qwen2-native issue-resolution model and the sole Moonshot model without a custom_code tag in this observation." },
    { "id": "kimi-k2-evolution", "label": "Kimi K2.5–K2.7 evolution", "kind": "model-lineage", "description": "Multimodal K2.5 and K2.6 variants followed by the K2.7 code-specialized variant." },
    { "id": "kimi-k2-text", "label": "Kimi K2 text", "kind": "model-lineage", "description": "Base, instruction, refreshed instruction, and thinking variants in the text-first K2 line." },
    { "id": "kimi-k3", "label": "Kimi K3", "kind": "model-lineage", "description": "Native multimodal MoE family with publisher-described agentic and long-context interfaces." },
    { "id": "kimi-linear", "label": "Kimi Linear", "kind": "model-lineage", "description": "Hybrid linear-attention research family with base and instruction variants." },
    { "id": "kimi-vl", "label": "Kimi VL and MoonViT", "kind": "model-lineage", "description": "Vision-language instruction and thinking variants with the related MoonViT image encoder." },
    { "id": "moonlight", "label": "Moonlight", "kind": "model-lineage", "description": "Muon-training research family with base and instruction variants." },
    { "id": "perception-evaluation", "label": "Perception and world-knowledge evaluation", "kind": "evaluation", "description": "PerceptionBench and WorldVQA keep perception, knowledge, and reasoning axes distinct." }
  ],
  "collections": [
    {
      "id": "kimi-audio-7b",
      "title": "Kimi-Audio-7B",
      "url": "https://huggingface.co/collections/moonshotai/kimi-audio-7b-680defb21c47be2edf281bd0",
      "profile_visible": true,
      "member_node_ids": ["kimi-audio-7b", "kimi-audio-7b-instruct", "kimi-audio-gentest"],
      "paper_ids": []
    },
    {
      "id": "kimi-k2",
      "title": "Kimi-K2",
      "url": "https://huggingface.co/collections/moonshotai/kimi-k2-6871243b990f2af5ba60617d",
      "profile_visible": true,
      "member_node_ids": ["kimi-k2-base", "kimi-k2-instruct", "kimi-k2-instruct-0905", "kimi-k2-thinking"],
      "paper_ids": []
    },
    {
      "id": "kimi-k2-5",